{
  "schema_version": "1.0",
  "native_event_schema_version": "1.3",
  "analysis_run_id": "0198fd40-1111-7000-8000-000000000004",
  "sample_sha256": "aaaaaaaaaaaaaaaaaaaaaaaaaaaaaaaaaaaaaaaaaaaaaaaaaaaaaaaaaaaaaaaa",
  "platform": "android",
  "created_at": "2026-08-08T12:06:00Z",
  "producer": {
    "name": "c2-exfil",
    "runtime_identity": "c2-exfil@bc5bb681495a02fa0ff2411087e5a00ece5b1ca3",
    "tool_versions": {
      "schema": "1.3"
    }
  },
  "pcap_sha256": "bbbbbbbbbbbbbbbbbbbbbbbbbbbbbbbbbbbbbbbbbbbbbbbbbbbbbbbbbbbbbbbb",
  "platform_manifest_sha256": "cccccccccccccccccccccccccccccccccccccccccccccccccccccccccccccccc",
  "correlation_mode": "network_only",
  "network_events": [
    {
      "event_id": "0198fd40-1111-7000-8000-000000000007",
      "sample_id": "aaaaaaaaaaaaaaaaaaaaaaaaaaaaaaaaaaaaaaaaaaaaaaaaaaaaaaaaaaaaaaaa",
      "session_id": null,
      "cape_task_id": null,
      "platform": "android",
      "timestamp": "2026-08-08T12:01:00Z",
      "data_type_accessed": null,
      "access_api_call": null,
      "destination_ip": "198.51.100.10",
      "destination_port": 443,
      "destination_domain": "fixture.invalid",
      "asn": null,
      "asn_org": null,
      "geo_country": null,
      "reputation_score": null,
      "reputation_note": null,
      "reputation_source": null,
      "ja3_hash": null,
      "plaintext_available": false,
      "confidence_score": 0.5,
      "confidence_tier": "weak",
      "mitre_technique_id": "T1071",
      "manifest_sha256": null,
      "evidence_hash": "dddddddddddddddddddddddddddddddddddddddddddddddddddddddddddddddd",
      "case_id": "0198fd40-1111-7000-8000-000000000004",
      "finding_kind": "beacon",
      "plain_language": "The application repeatedly contacted a remote server.",
      "capped_by_caveat": "c2_network_only",
      "evidence_refs": []
    }
  ],
  "artifacts": [],
  "caveats": [
    "c2_network_only"
  ],
  "evidence_chain": {
    "root": "cccccccccccccccccccccccccccccccccccccccccccccccccccccccccccccccc",
    "tip": "dddddddddddddddddddddddddddddddddddddddddddddddddddddddddddddddd"
  },
  "signature": {
    "key_id": "fixture",
    "algorithm": "Ed25519",
    "value": "sanitized"
  },
  "analysis_window": {
    "started_at": "2026-08-08T12:00:00Z",
    "ended_at": "2026-08-08T12:05:00Z"
  },
  "guest_ip": "10.0.2.15"
}
